{
  "schema": "xprimeray.glowing_heart.fixture_resolution_ladder.v0.preview",
  "generatedUtc": "2026-07-03T16:16:33Z",
  "milestone": "Glowing Heart v3.4 \u2014 Fixture Library Resolution Ladder",
  "parityClaim": "NONE",
  "tiers": [
    {
      "id": "smoke",
      "description": "Fixture-declared current grid.",
      "targetWidth": null,
      "targetHeight": null
    },
    {
      "id": "mini",
      "description": "Generated temporary 80x44 fixture variant.",
      "targetWidth": 80,
      "targetHeight": 44
    },
    {
      "id": "standard",
      "description": "Generated temporary 320x176 normal-target variant.",
      "targetWidth": 320,
      "targetHeight": 176
    },
    {
      "id": "high",
      "description": "Optional tier; deferred in the conservative v3.4 ladder.",
      "targetWidth": 640,
      "targetHeight": 352
    }
  ],
  "records": [
    {
      "fixtureName": "grin_radial_smoke",
      "fixturePath": "Fixtures/grin_radial_smoke.json",
      "tier": "smoke",
      "gridWidth": 40,
      "gridHeight": 22,
      "rayCount": 880,
      "status": "PASS",
      "runtimeSeconds": 0.514315,
      "meanBend": 0.000983294914,
      "maxBend": 0.00562361022,
      "artifactPath": "output/glowing_heart_library_v3_4/runs/grin_radial_smoke/smoke/20260703T161626Z_grin_radial_smoke",
      "publishedAssetPath": "Docs/assets/glowing_heart/v3_4/grin_radial_smoke/smoke",
      "reason": null
    },
    {
      "fixtureName": "grin_radial_smoke",
      "fixturePath": "Fixtures/grin_radial_smoke.json",
      "tier": "mini",
      "gridWidth": 80,
      "gridHeight": 44,
      "rayCount": 3520,
      "status": "PASS",
      "runtimeSeconds": 0.479934,
      "meanBend": 0.000982908765,
      "maxBend": 0.00562452199,
      "artifactPath": "output/glowing_heart_library_v3_4/runs/grin_radial_smoke/mini/20260703T161627Z_grin_radial_smoke",
      "publishedAssetPath": "Docs/assets/glowing_heart/v3_4/grin_radial_smoke/mini",
      "reason": null
    },
    {
      "fixtureName": "grin_radial_smoke",
      "fixturePath": "Fixtures/grin_radial_smoke.json",
      "tier": "standard",
      "gridWidth": 320,
      "gridHeight": 176,
      "rayCount": 56320,
      "status": "PASS",
      "runtimeSeconds": 1.029767,
      "meanBend": 0.000982794212,
      "maxBend": 0.00562451966,
      "artifactPath": "output/glowing_heart_library_v3_4/runs/grin_radial_smoke/standard/20260703T161628Z_grin_radial_smoke",
      "publishedAssetPath": "Docs/assets/glowing_heart/v3_4/grin_radial_smoke/standard",
      "reason": null
    },
    {
      "fixtureName": "grin_radial_smoke",
      "fixturePath": "Fixtures/grin_radial_smoke.json",
      "tier": "high",
      "gridWidth": 640,
      "gridHeight": 352,
      "rayCount": 225280,
      "status": "DEFERRED",
      "runtimeSeconds": null,
      "meanBend": null,
      "maxBend": null,
      "artifactPath": null,
      "publishedAssetPath": null,
      "reason": "Optional high tier deferred after the conservative standard target."
    },
    {
      "fixtureName": "grin_radial_smoke_observer_variant",
      "fixturePath": "Fixtures/grin_radial_smoke_observer_variant.json",
      "tier": "smoke",
      "gridWidth": 40,
      "gridHeight": 22,
      "rayCount": 880,
      "status": "PASS",
      "runtimeSeconds": 0.420278,
      "meanBend": 0.000958973251,
      "maxBend": 0.00562446611,
      "artifactPath": "output/glowing_heart_library_v3_4/runs/grin_radial_smoke_observer_variant/smoke/20260703T161628Z_grin_radial_smoke_observer_variant",
      "publishedAssetPath": "Docs/assets/glowing_heart/v3_4/grin_radial_smoke_observer_variant/smoke",
      "reason": null
    },
    {
      "fixtureName": "grin_radial_smoke_observer_variant",
      "fixturePath": "Fixtures/grin_radial_smoke_observer_variant.json",
      "tier": "mini",
      "gridWidth": 80,
      "gridHeight": 44,
      "rayCount": 3520,
      "status": "PASS",
      "runtimeSeconds": 0.469879,
      "meanBend": 0.000958600664,
      "maxBend": 0.00562450336,
      "artifactPath": "output/glowing_heart_library_v3_4/runs/grin_radial_smoke_observer_variant/mini/20260703T161629Z_grin_radial_smoke_observer_variant",
      "publishedAssetPath": "Docs/assets/glowing_heart/v3_4/grin_radial_smoke_observer_variant/mini",
      "reason": null
    },
    {
      "fixtureName": "grin_radial_smoke_observer_variant",
      "fixturePath": "Fixtures/grin_radial_smoke_observer_variant.json",
      "tier": "standard",
      "gridWidth": 320,
      "gridHeight": 176,
      "rayCount": 56320,
      "status": "PASS",
      "runtimeSeconds": 1.027324,
      "meanBend": 0.000958488963,
      "maxBend": 0.0056245178,
      "artifactPath": "output/glowing_heart_library_v3_4/runs/grin_radial_smoke_observer_variant/standard/20260703T161630Z_grin_radial_smoke_observer_variant",
      "publishedAssetPath": "Docs/assets/glowing_heart/v3_4/grin_radial_smoke_observer_variant/standard",
      "reason": null
    },
    {
      "fixtureName": "grin_radial_smoke_observer_variant",
      "fixturePath": "Fixtures/grin_radial_smoke_observer_variant.json",
      "tier": "high",
      "gridWidth": 640,
      "gridHeight": 352,
      "rayCount": 225280,
      "status": "DEFERRED",
      "runtimeSeconds": null,
      "meanBend": null,
      "maxBend": null,
      "artifactPath": null,
      "publishedAssetPath": null,
      "reason": "Optional high tier deferred after the conservative standard target."
    },
    {
      "fixtureName": "grin_radial_smoke_resolution_variant",
      "fixturePath": "Fixtures/grin_radial_smoke_resolution_variant.json",
      "tier": "smoke",
      "gridWidth": 41,
      "gridHeight": 22,
      "rayCount": 902,
      "status": "PASS",
      "runtimeSeconds": 0.434112,
      "meanBend": 0.000960229547,
      "maxBend": 0.00562415784,
      "artifactPath": "output/glowing_heart_library_v3_4/runs/grin_radial_smoke_resolution_variant/smoke/20260703T161630Z_grin_radial_smoke_resolution_variant",
      "publishedAssetPath": "Docs/assets/glowing_heart/v3_4/grin_radial_smoke_resolution_variant/smoke",
      "reason": null
    },
    {
      "fixtureName": "grin_radial_smoke_resolution_variant",
      "fixturePath": "Fixtures/grin_radial_smoke_resolution_variant.json",
      "tier": "mini",
      "gridWidth": 80,
      "gridHeight": 44,
      "rayCount": 3520,
      "status": "PASS",
      "runtimeSeconds": 0.4638,
      "meanBend": 0.000982908765,
      "maxBend": 0.00562452199,
      "artifactPath": "output/glowing_heart_library_v3_4/runs/grin_radial_smoke_resolution_variant/mini/20260703T161630Z_grin_radial_smoke_resolution_variant",
      "publishedAssetPath": "Docs/assets/glowing_heart/v3_4/grin_radial_smoke_resolution_variant/mini",
      "reason": null
    },
    {
      "fixtureName": "grin_radial_smoke_resolution_variant",
      "fixturePath": "Fixtures/grin_radial_smoke_resolution_variant.json",
      "tier": "standard",
      "gridWidth": 320,
      "gridHeight": 176,
      "rayCount": 56320,
      "status": "PASS",
      "runtimeSeconds": 1.026158,
      "meanBend": 0.000982794212,
      "maxBend": 0.00562451966,
      "artifactPath": "output/glowing_heart_library_v3_4/runs/grin_radial_smoke_resolution_variant/standard/20260703T161631Z_grin_radial_smoke_resolution_variant",
      "publishedAssetPath": "Docs/assets/glowing_heart/v3_4/grin_radial_smoke_resolution_variant/standard",
      "reason": null
    },
    {
      "fixtureName": "grin_radial_smoke_resolution_variant",
      "fixturePath": "Fixtures/grin_radial_smoke_resolution_variant.json",
      "tier": "high",
      "gridWidth": 640,
      "gridHeight": 352,
      "rayCount": 225280,
      "status": "DEFERRED",
      "runtimeSeconds": null,
      "meanBend": null,
      "maxBend": null,
      "artifactPath": null,
      "publishedAssetPath": null,
      "reason": "Optional high tier deferred after the conservative standard target."
    },
    {
      "fixtureName": "grin_radial_smoke_variant",
      "fixturePath": "Fixtures/grin_radial_smoke_variant.json",
      "tier": "smoke",
      "gridWidth": 40,
      "gridHeight": 22,
      "rayCount": 880,
      "status": "PASS",
      "runtimeSeconds": 0.431982,
      "meanBend": 0.00117876683,
      "maxBend": 0.00671275519,
      "artifactPath": "output/glowing_heart_library_v3_4/runs/grin_radial_smoke_variant/smoke/20260703T161632Z_grin_radial_smoke_variant",
      "publishedAssetPath": "Docs/assets/glowing_heart/v3_4/grin_radial_smoke_variant/smoke",
      "reason": null
    },
    {
      "fixtureName": "grin_radial_smoke_variant",
      "fixturePath": "Fixtures/grin_radial_smoke_variant.json",
      "tier": "mini",
      "gridWidth": 80,
      "gridHeight": 44,
      "rayCount": 3520,
      "status": "PASS",
      "runtimeSeconds": 0.445424,
      "meanBend": 0.00117830385,
      "maxBend": 0.00671569305,
      "artifactPath": "output/glowing_heart_library_v3_4/runs/grin_radial_smoke_variant/mini/20260703T161632Z_grin_radial_smoke_variant",
      "publishedAssetPath": "Docs/assets/glowing_heart/v3_4/grin_radial_smoke_variant/mini",
      "reason": null
    },
    {
      "fixtureName": "grin_radial_smoke_variant",
      "fixturePath": "Fixtures/grin_radial_smoke_variant.json",
      "tier": "standard",
      "gridWidth": 320,
      "gridHeight": 176,
      "rayCount": 56320,
      "status": "PASS",
      "runtimeSeconds": 1.034909,
      "meanBend": 0.0011781666,
      "maxBend": 0.00671578944,
      "artifactPath": "output/glowing_heart_library_v3_4/runs/grin_radial_smoke_variant/standard/20260703T161633Z_grin_radial_smoke_variant",
      "publishedAssetPath": "Docs/assets/glowing_heart/v3_4/grin_radial_smoke_variant/standard",
      "reason": null
    },
    {
      "fixtureName": "grin_radial_smoke_variant",
      "fixturePath": "Fixtures/grin_radial_smoke_variant.json",
      "tier": "high",
      "gridWidth": 640,
      "gridHeight": 352,
      "rayCount": 225280,
      "status": "DEFERRED",